15:48:03.101328 IP 192.168.153.104.61021 > 192.168.200.254.domain: 39644+ [1au] A? google.com. (39)
15:48:03.101630 IP 192.168.200.254.domain > 192.168.153.104.61021: 39644 1/0/1 A 172.217.26.238 (55)
15:48:03.397505 IP 192.168.153.104.38294 > 192.168.200.254.domain: 26556+ PTR? 254.200.168.192.in-addr.arpa. (46)
15:48:03.397883 IP 192.168.200.254.domain > 192.168.153.104.38294: 26556 NXDomain 0/0/0 (46)
15:48:03.398366 IP 192.168.153.104.65074 > 192.168.200.254.domain: 64092+ PTR? 104.153.168.192.in-addr.arpa. (46)
15:48:03.398684 IP 192.168.200.254.domain > 192.168.153.104.65074: 64092 NXDomain 0/0/0 (46)

